title,abstract,date,authors,arxiv_id,primary_category
Resource for Error Analysis in Text Simplification: New Taxonomy and Test Collection,"The general public often encounters complex texts but does not have the time or expertise to fully understand them, leading to the spread of misinformation. Automatic Text Simplification (ATS) helps make information more accessible, but its evaluation methods have not kept up with advances in text generation, especially with Large Language Models (LLMs). In particular, recent studies have shown that current ATS metrics do not correlate with the presence of errors. Manual inspections have further revealed a variety of errors, underscoring the need for a more nuanced evaluation framework, which is currently lacking. This resource paper addresses this gap by introducing a test collection for detecting and classifying errors in simplified texts. First, we propose a taxonomy of errors, with a formal focus on information distortion. Next, we introduce a parallel dataset of automatically simplified scientific texts. This dataset has been human-annotated with labels based on our proposed taxonomy. Finally, we analyze the quality of the dataset, and we study the performance of existing models to detect and classify errors from that taxonomy. These contributions give researchers the tools to better evaluate errors in ATS, develop more reliable models, and ultimately improve the quality of automatically simplified texts.",2025-05-22 08:45:14+00:00,"Benjamin Vendeville, Liana Ermakova, Pierre De Loor",2505.16392v1,cs.CL
"Serious Games: Human-AI Interaction, Evolution, and Coevolution","The serious games between humans and AI have only just begun. Evolutionary Game Theory (EGT) models the competitive and cooperative strategies of biological entities. EGT could help predict the potential evolutionary equilibrium of humans and AI. The objective of this work was to examine some of the EGT models relevant to human-AI interaction, evolution, and coevolution. Of thirteen EGT models considered, three were examined: the Hawk-Dove Game, Iterated Prisoner's Dilemma, and the War of Attrition. This selection was based on the widespread acceptance and clear relevance of these models to potential human-AI evolutionary dynamics and coevolutionary trajectories. The Hawk-Dove Game predicts balanced mixed-strategy equilibria based on the costs of conflict. It also shows the potential for balanced coevolution rather than dominance. Iterated Prisoner's Dilemma suggests that repeated interaction may lead to cognitive coevolution. It demonstrates how memory and reciprocity can lead to cooperation. The War of Attrition suggests that competition for resources may result in strategic coevolution, asymmetric equilibria, and conventions on sharing resources. Therefore, EGT may provide a suitable framework to understand and predict the human-AI evolutionary dynamic. However, future research could extend beyond EGT and explore additional frameworks, empirical validation methods, and interdisciplinary perspectives. AI is being shaped by human input and is evolving in response to it. So too, neuroplasticity allows the human brain to grow and evolve in response to stimuli. If humans and AI converge in future, what might be the result of human neuroplasticity combined with an ever-evolving AI? Future research should be mindful of the ethical and cognitive implications of human-AI interaction, evolution, and coevolution.",2025-05-22 08:41:37+00:00,"Nandini Doreswamy, Louise Horstmanshof",2505.16388v1,cs.AI
Materials Generation in the Era of Artificial Intelligence: A Comprehensive Survey,"Materials are the foundation of modern society, underpinning advancements in energy, electronics, healthcare, transportation, and infrastructure. The ability to discover and design new materials with tailored properties is critical to solving some of the most pressing global challenges. In recent years, the growing availability of high-quality materials data combined with rapid advances in Artificial Intelligence (AI) has opened new opportunities for accelerating materials discovery. Data-driven generative models provide a powerful tool for materials design by directly create novel materials that satisfy predefined property requirements. Despite the proliferation of related work, there remains a notable lack of up-to-date and systematic surveys in this area. To fill this gap, this paper provides a comprehensive overview of recent progress in AI-driven materials generation. We first organize various types of materials and illustrate multiple representations of crystalline materials. We then provide a detailed summary and taxonomy of current AI-driven materials generation approaches. Furthermore, we discuss the common evaluation metrics and summarize open-source codes and benchmark datasets. Finally, we conclude with potential future directions and challenges in this fast-growing field. The related sources can be found at https://github.com/ZhixunLEE/Awesome-AI-for-Materials-Generation.",2025-05-22 08:33:21+00:00,"Zhixun Li, Bin Cao, Rui Jiao, Liang Wang, Ding Wang, Yang Liu, Dingshuo Chen, Jia Li, Qiang Liu, Yu Rong, Liang Wang, Tong-yi Zhang, Jeffrey Xu Yu",2505.16379v1,cond-mat.mtrl-sci
VL-SAFE: Vision-Language Guided Safety-Aware Reinforcement Learning with World Models for Autonomous Driving,"Reinforcement learning (RL)-based autonomous driving policy learning faces critical limitations such as low sample efficiency and poor generalization; its reliance on online interactions and trial-and-error learning is especially unacceptable in safety-critical scenarios. Existing methods including safe RL often fail to capture the true semantic meaning of ""safety"" in complex driving contexts, leading to either overly conservative driving behavior or constraint violations. To address these challenges, we propose VL-SAFE, a world model-based safe RL framework with Vision-Language model (VLM)-as-safety-guidance paradigm, designed for offline safe policy learning. Specifically, we construct offline datasets containing data collected by expert agents and labeled with safety scores derived from VLMs. A world model is trained to generate imagined rollouts together with safety estimations, allowing the agent to perform safe planning without interacting with the real environment. Based on these imagined trajectories and safety evaluations, actor-critic learning is conducted under VLM-based safety guidance to optimize the driving policy more safely and efficiently. Extensive evaluations demonstrate that VL-SAFE achieves superior sample efficiency, generalization, safety, and overall performance compared to existing baselines. To the best of our knowledge, this is the first work that introduces a VLM-guided world model-based approach for safe autonomous driving. The demo video and code can be accessed at: https://ys-qu.github.io/vlsafe-website/",2025-05-22 08:29:59+00:00,"Yansong Qu, Zilin Huang, Zihao Sheng, Jiancong Chen, Sikai Chen, Samuel Labi",2505.16377v1,cs.RO
DeCafNet: Delegate and Conquer for Efficient Temporal Grounding in Long Videos,"Long Video Temporal Grounding (LVTG) aims at identifying specific moments within lengthy videos based on user-provided text queries for effective content retrieval. The approach taken by existing methods of dividing video into clips and processing each clip via a full-scale expert encoder is challenging to scale due to prohibitive computational costs of processing a large number of clips in long videos. To address this issue, we introduce DeCafNet, an approach employing ``delegate-and-conquer'' strategy to achieve computation efficiency without sacrificing grounding performance. DeCafNet introduces a sidekick encoder that performs dense feature extraction over all video clips in a resource-efficient manner, while generating a saliency map to identify the most relevant clips for full processing by the expert encoder. To effectively leverage features from sidekick and expert encoders that exist at different temporal resolutions, we introduce DeCaf-Grounder, which unifies and refines them via query-aware temporal aggregation and multi-scale temporal refinement for accurate grounding. Experiments on two LTVG benchmark datasets demonstrate that DeCafNet reduces computation by up to 47\% while still outperforming existing methods, establishing a new state-of-the-art for LTVG in terms of both efficiency and performance. Our code is available at https://github.com/ZijiaLewisLu/CVPR2025-DeCafNet.",2025-05-22 08:29:57+00:00,"Zijia Lu, A S M Iftekhar, Gaurav Mittal, Tianjian Meng, Xiawei Wang, Cheng Zhao, Rohith Kukkala, Ehsan Elhamifar, Mei Chen",2505.16376v1,cs.CV
Temporal and Spatial Feature Fusion Framework for Dynamic Micro Expression Recognition,"When emotions are repressed, an individual's true feelings may be revealed through micro-expressions. Consequently, micro-expressions are regarded as a genuine source of insight into an individual's authentic emotions. However, the transient and highly localised nature of micro-expressions poses a significant challenge to their accurate recognition, with the accuracy rate of micro-expression recognition being as low as 50%, even for professionals. In order to address these challenges, it is necessary to explore the field of dynamic micro expression recognition (DMER) using multimodal fusion techniques, with special attention to the diverse fusion of temporal and spatial modal features. In this paper, we propose a novel Temporal and Spatial feature Fusion framework for DMER (TSFmicro). This framework integrates a Retention Network (RetNet) and a transformer-based DMER network, with the objective of efficient micro-expression recognition through the capture and fusion of temporal and spatial relations. Meanwhile, we propose a novel parallel time-space fusion method from the perspective of modal fusion, which fuses spatio-temporal information in high-dimensional feature space, resulting in complementary ""where-how"" relationships at the semantic level and providing richer semantic information for the model. The experimental results demonstrate the superior performance of the TSFmicro method in comparison to other contemporary state-of-the-art methods. This is evidenced by its effectiveness on three well-recognised micro-expression datasets.",2025-05-22 08:26:19+00:00,"Feng Liu, Bingyu Nan, Xuezhong Qian, Xiaolan Fu",2505.16372v1,cs.CV
SATURN: SAT-based Reinforcement Learning to Unleash Language Model Reasoning,"How to design reinforcement learning (RL) tasks that effectively unleash the reasoning capability of large language models (LLMs) remains an open question. Existing RL tasks (e.g., math, programming, and constructing reasoning tasks) suffer from three key limitations: (1) Scalability. They rely heavily on human annotation or expensive LLM synthesis to generate sufficient training data. (2) Verifiability. LLMs' outputs are hard to verify automatically and reliably. (3) Controllable Difficulty. Most tasks lack fine-grained difficulty control, making it hard to train LLMs to develop reasoning ability from easy to hard. To address these limitations, we propose Saturn, a SAT-based RL framework that uses Boolean Satisfiability (SAT) problems to train and evaluate LLM reasoning. Saturn enables scalable task construction, rule-based verification, and precise difficulty control. Saturn designs a curriculum learning pipeline that continuously improves LLMs' reasoning capability by constructing SAT tasks of increasing difficulty and training LLMs from easy to hard. To ensure stable training, we design a principled mechanism to control difficulty transitions. We introduce Saturn-2.6k, a dataset of 2,660 SAT problems with varying difficulty. It supports the evaluation of how LLM reasoning changes with problem difficulty. We apply Saturn to DeepSeek-R1-Distill-Qwen and obtain Saturn-1.5B and Saturn-7B. We achieve several notable results: (1) On SAT problems, Saturn-1.5B and Saturn-7B achieve average pass@3 improvements of +14.0 and +28.1, respectively. (2) On math and programming tasks, Saturn-1.5B and Saturn-7B improve average scores by +4.9 and +1.8 on benchmarks (e.g., AIME, LiveCodeBench). (3) Compared to the state-of-the-art (SOTA) approach in constructing RL tasks, Saturn achieves further improvements of +8.8%. We release the source code, data, and models to support future research.",2025-05-22 08:23:10+00:00,"Huanyu Liu, Jia Li, Hao Zhu, Kechi Zhang, Yihong Dong, Ge Li",2505.16368v1,cs.LG
A collaborative constrained graph diffusion model for the generation of realistic synthetic molecules,"Developing new molecular compounds is crucial to address pressing challenges, from health to environmental sustainability. However, exploring the molecular space to discover new molecules is difficult due to the vastness of the space. Here we introduce CoCoGraph, a collaborative and constrained graph diffusion model capable of generating molecules that are guaranteed to be chemically valid. Thanks to the constraints built into the model and to the collaborative mechanism, CoCoGraph outperforms state-of-the-art approaches on standard benchmarks while requiring up to an order of magnitude fewer parameters. Analysis of 36 chemical properties also demonstrates that CoCoGraph generates molecules with distributions more closely matching real molecules than current models. Leveraging the model's efficiency, we created a database of 8.2M million synthetically generated molecules and conducted a Turing-like test with organic chemistry experts to further assess the plausibility of the generated molecules, and potential biases and limitations of CoCoGraph.",2025-05-22 08:21:27+00:00,"Manuel Ruiz-Botella, Marta Sales-Pardo, Roger Guimerà",2505.16365v1,cs.LG
AdamS: Momentum Itself Can Be A Normalizer for LLM Pretraining and Post-training,"We introduce AdamS, a simple yet effective alternative to Adam for large language model (LLM) pretraining and post-training. By leveraging a novel denominator, i.e., the root of weighted sum of squares of the momentum and the current gradient, AdamS eliminates the need for second-moment estimates. Hence, AdamS is efficient, matching the memory and compute footprint of SGD with momentum while delivering superior optimization performance. Moreover, AdamS is easy to adopt: it can directly inherit hyperparameters of AdamW, and is entirely model-agnostic, integrating seamlessly into existing pipelines without modifications to optimizer APIs or architectures. The motivation behind AdamS stems from the observed $(L_0, L_1)$ smoothness properties in transformer objectives, where local smoothness is governed by gradient magnitudes that can be further approximated by momentum magnitudes. We establish rigorous theoretical convergence guarantees and provide practical guidelines for hyperparameter selection. Empirically, AdamS demonstrates strong performance in various tasks, including pre-training runs on GPT-2 and Llama2 (up to 13B parameters) and reinforcement learning in post-training regimes. With its efficiency, simplicity, and theoretical grounding, AdamS stands as a compelling alternative to existing optimizers.",2025-05-22 08:16:48+00:00,"Huishuai Zhang, Bohan Wang, Luoxin Chen",2505.16363v1,cs.LG
"Neuromorphic-based metaheuristics: A new generation of low power, low latency and small footprint optimization algorithms","Neuromorphic computing (NC) introduces a novel algorithmic paradigm representing a major shift from traditional digital computing of Von Neumann architectures. NC emulates or simulates the neural dynamics of brains in the form of Spiking Neural Networks (SNNs). Much of the research in NC has concentrated on machine learning applications and neuroscience simulations. This paper investigates the modelling and implementation of optimization algorithms and particularly metaheuristics using the NC paradigm as an alternative to Von Neumann architectures, leading to breakthroughs in solving optimization problems. Neuromorphic-based metaheuristics (Nheuristics) are supposed to be characterized by low power, low latency and small footprint. Since NC systems are fundamentally different from conventional Von Neumann computers, several challenges are posed to the design and implementation of Nheuristics. A guideline based on a classification and critical analysis is conducted on the different families of metaheuristics and optimization problems they address. We also discuss future directions that need to be addressed to expand both the development and application of Nheuristics.",2025-05-22 08:14:07+00:00,El-ghazali Talbi,2505.16362v1,cs.NE
Dysfluent WFST: A Framework for Zero-Shot Speech Dysfluency Transcription and Detection,"Automatic detection of speech dysfluency aids speech-language pathologists in efficient transcription of disordered speech, enhancing diagnostics and treatment planning. Traditional methods, often limited to classification, provide insufficient clinical insight, and text-independent models misclassify dysfluency, especially in context-dependent cases. This work introduces Dysfluent-WFST, a zero-shot decoder that simultaneously transcribes phonemes and detects dysfluency. Unlike previous models, Dysfluent-WFST operates with upstream encoders like WavLM and requires no additional training. It achieves state-of-the-art performance in both phonetic error rate and dysfluency detection on simulated and real speech data. Our approach is lightweight, interpretable, and effective, demonstrating that explicit modeling of pronunciation behavior in decoding, rather than complex architectures, is key to improving dysfluency processing systems.",2025-05-22 08:02:50+00:00,"Chenxu Guo, Jiachen Lian, Xuanru Zhou, Jinming Zhang, Shuhe Li, Zongli Ye, Hwi Joo Park, Anaisha Das, Zoe Ezzes, Jet Vonk, Brittany Morin, Rian Bogley, Lisa Wauters, Zachary Miller, Maria Gorno-Tempini, Gopala Anumanchipalli",2505.16351v1,eess.AS
FPQVAR: Floating Point Quantization for Visual Autoregressive Model with FPGA Hardware Co-design,"Visual autoregressive (VAR) modeling has marked a paradigm shift in image generation from next-token prediction to next-scale prediction. VAR predicts a set of tokens at each step from coarse to fine scale, leading to better image quality and faster inference speed compared to existing diffusion models. However, the large parameter size and computation cost hinder its deployment on edge devices. To reduce the memory and computation cost, we propose FPQVAR, an efficient post-training floating-point (FP) quantization framework for VAR featuring algorithm and hardware co-design. At the algorithm level, we first identify the challenges of quantizing VAR. To address them, we propose Dual Format Quantization for the highly imbalanced input activation. We further propose Group-wise Hadamard Transformation and GHT-Aware Learnable Transformation to address the time-varying outlier channels. At the hardware level, we design the first low-bit FP quantizer and multiplier with lookup tables on FPGA and propose the first FPGA-based VAR accelerator featuring low-bit FP computation and an elaborate two-level pipeline. Extensive experiments show that compared to the state-of-the-art quantization method, our proposed FPQVAR significantly improves Fr\'echet Inception Distance (FID) from 10.83 to 3.58, Inception Score (IS) from 175.9 to 241.5 under 4-bit quantization. FPQVAR also significantly improves the performance of 6-bit quantized VAR, bringing it on par with the FP16 model. Our accelerator on AMD-Xilinx VCK190 FPGA achieves a throughput of 1.1 image/s, which is 3.1x higher than the integer-based accelerator. It also demonstrates 3.6x and 2.8x higher energy efficiency compared to the integer-based accelerator and GPU baseline, respectively.",2025-05-22 07:47:51+00:00,"Renjie Wei, Songqiang Xu, Qingyu Guo, Meng Li",2505.16335v1,cs.CV
Is Quantum Optimization Ready? An Effort Towards Neural Network Compression using Adiabatic Quantum Computing,"Quantum optimization is the most mature quantum computing technology to date, providing a promising approach towards efficiently solving complex combinatorial problems. Methods such as adiabatic quantum computing (AQC) have been employed in recent years on important optimization problems across various domains. In deep learning, deep neural networks (DNN) have reached immense sizes to support new predictive capabilities. Optimization of large-scale models is critical for sustainable deployment, but becomes increasingly challenging with ever-growing model sizes and complexity. While quantum optimization is suitable for solving complex problems, its application to DNN optimization is not straightforward, requiring thorough reformulation for compatibility with commercially available quantum devices. In this work, we explore the potential of adopting AQC for fine-grained pruning-quantization of convolutional neural networks. We rework established heuristics to formulate model compression as a quadratic unconstrained binary optimization (QUBO) problem, and assess the solution space offered by commercial quantum annealing devices. Through our exploratory efforts of reformulation, we demonstrate that AQC can achieve effective compression of practical DNN models. Experiments demonstrate that adiabatic quantum computing (AQC) not only outperforms classical algorithms like genetic algorithms and reinforcement learning in terms of time efficiency but also excels at identifying global optima.",2025-05-22 07:40:23+00:00,"Zhehui Wanga, Benjamin Chen Ming Choonga, Tian Huang, Daniel Gerlinghoffa, Rick Siow Mong Goh, Cheng Liu, Tao Luo",2505.16332v1,quant-ph
SC4ANM: Identifying Optimal Section Combinations for Automated Novelty Prediction in Academic Papers,"Novelty is a core component of academic papers, and there are multiple perspectives on the assessment of novelty. Existing methods often focus on word or entity combinations, which provide limited insights. The content related to a paper's novelty is typically distributed across different core sections, e.g., Introduction, Methodology and Results. Therefore, exploring the optimal combination of sections for evaluating the novelty of a paper is important for advancing automated novelty assessment. In this paper, we utilize different combinations of sections from academic papers as inputs to drive language models to predict novelty scores. We then analyze the results to determine the optimal section combinations for novelty score prediction. We first employ natural language processing techniques to identify the sectional structure of academic papers, categorizing them into introduction, methods, results, and discussion (IMRaD). Subsequently, we used different combinations of these sections (e.g., introduction and methods) as inputs for pretrained language models (PLMs) and large language models (LLMs), employing novelty scores provided by human expert reviewers as ground truth labels to obtain prediction results. The results indicate that using introduction, results and discussion is most appropriate for assessing the novelty of a paper, while the use of the entire text does not yield significant results. Furthermore, based on the results of the PLMs and LLMs, the introduction and results appear to be the most important section for the task of novelty score prediction. The code and dataset for this paper can be accessed at https://github.com/njust-winchy/SC4ANM.",2025-05-22 07:34:59+00:00,"Wenqing Wu, Chengzhi Zhang, Tong Bao, Yi Zhao",2505.16330v1,cs.CL
CLEAR: A Clinically-Grounded Tabular Framework for Radiology Report Evaluation,"Existing metrics often lack the granularity and interpretability to capture nuanced clinical differences between candidate and ground-truth radiology reports, resulting in suboptimal evaluation. We introduce a Clinically-grounded tabular framework with Expert-curated labels and Attribute-level comparison for Radiology report evaluation (CLEAR). CLEAR not only examines whether a report can accurately identify the presence or absence of medical conditions, but also assesses whether it can precisely describe each positively identified condition across five key attributes: first occurrence, change, severity, descriptive location, and recommendation. Compared to prior works, CLEAR's multi-dimensional, attribute-level outputs enable a more comprehensive and clinically interpretable evaluation of report quality. Additionally, to measure the clinical alignment of CLEAR, we collaborate with five board-certified radiologists to develop CLEAR-Bench, a dataset of 100 chest X-ray reports from MIMIC-CXR, annotated across 6 curated attributes and 13 CheXpert conditions. Our experiments show that CLEAR achieves high accuracy in extracting clinical attributes and provides automated metrics that are strongly aligned with clinical judgment.",2025-05-22 07:32:12+00:00,"Yuyang Jiang, Chacha Chen, Shengyuan Wang, Feng Li, Zecong Tang, Benjamin M. Mervak, Lydia Chelala, Christopher M Straus, Reve Chahine, Samuel G. Armato III, Chenhao Tan",2505.16325v1,cs.CL
