title,abstract,date,authors,arxiv_id,primary_category
Towards a Working Definition of Designing Generative User Interfaces,"Generative UI is transforming interface design by facilitating AI-driven collaborative workflows between designers and computational systems. This study establishes a working definition of Generative UI through a multi-method qualitative approach, integrating insights from a systematic literature review of 127 publications, expert interviews with 18 participants, and analyses of 12 case studies. Our findings identify five core themes that position Generative UI as an iterative and co-creative process. We highlight emerging design models, including hybrid creation, curation-based workflows, and AI-assisted refinement strategies. Additionally, we examine ethical challenges, evaluation criteria, and interaction models that shape the field. By proposing a conceptual foundation, this study advances both theoretical discourse and practical implementation, guiding future HCI research toward responsible and effective generative UI design practices.",2025-05-21 03:14:09+00:00,Kyungho Lee,2505.15049v1,cs.HC
PiFlow: Principle-aware Scientific Discovery with Multi-Agent Collaboration,"Large Language Model (LLM)-based multi-agent systems (MAS) demonstrate remarkable potential for scientific discovery. Existing approaches, however, often automate scientific discovery using predefined workflows that lack rationality constraints. This often leads to aimless hypothesizing and a failure to consistently link hypotheses with evidence, thereby hindering systematic uncertainty reduction. Overcoming these limitations fundamentally requires systematic uncertainty reduction. We introduce {PiFlow}, an information-theoretical framework, treating automated scientific discovery as a structured uncertainty reduction problem guided by principles (e.g., scientific laws). In evaluations across three distinct scientific domains -- discovering nanomaterial structures, bio-molecules, and superconductor candidates with targeted properties -- our method significantly improves discovery efficiency, reflected by a 73.55\% increase in the Area Under the Curve (AUC) of property values versus exploration steps, and enhances solution quality by 94.06\% compared to a vanilla agent system. Overall, {PiFlow} serves as a Plug-and-Play method, establishing a novel paradigm shift in highly efficient automated scientific discovery, paving the way for more robust and accelerated AI-driven research. Code is publicly available at our {https://github.com/amair-lab/PiFlow}{GitHub}.",2025-05-21 03:09:39+00:00,"Yingming Pu, Tao Lin, Hongyu Chen",2505.15047v1,cs.LG
ChartCards: A Chart-Metadata Generation Framework for Multi-Task Chart Understanding,"The emergence of Multi-modal Large Language Models (MLLMs) presents new opportunities for chart understanding. However, due to the fine-grained nature of these tasks, applying MLLMs typically requires large, high-quality datasets for task-specific fine-tuning, leading to high data collection and training costs. To address this, we propose ChartCards, a unified chart-metadata generation framework for multi-task chart understanding. ChartCards systematically synthesizes various chart information, including data tables, visualization code, visual elements, and multi-dimensional semantic captions. By structuring this information into organized metadata, ChartCards enables a single chart to support multiple downstream tasks, such as text-to-chart retrieval, chart summarization, chart-to-table conversion, chart description, and chart question answering. Using ChartCards, we further construct MetaChart, a large-scale high-quality dataset containing 10,862 data tables, 85K charts, and 170 K high-quality chart captions. We validate the dataset through qualitative crowdsourcing evaluations and quantitative fine-tuning experiments across various chart understanding tasks. Fine-tuning six different models on MetaChart resulted in an average performance improvement of 5% across all tasks. The most notable improvements are seen in text-to-chart retrieval and chart-to-table tasks, with Long-CLIP and Llama 3.2-11B achieving improvements of 17% and 28%, respectively.",2025-05-21 03:07:47+00:00,"Yifan Wu, Lutao Yan, Leixian Shen, Yinan Mei, Jiannan Wang, Yuyu Luo",2505.15046v2,cs.CL
Learning-based Airflow Inertial Odometry for MAVs using Thermal Anemometers in a GPS and vision denied environment,"This work demonstrates an airflow inertial based odometry system with multi-sensor data fusion, including thermal anemometer, IMU, ESC, and barometer. This goal is challenging because low-cost IMUs and barometers have significant bias, and anemometer measurements are very susceptible to interference from spinning propellers and ground effects. We employ a GRU-based deep neural network to estimate relative air speed from noisy and disturbed anemometer measurements, and an observer with bias model to fuse the sensor data and thus estimate the state of aerial vehicle. A complete flight data, including takeoff and landing on the ground, shows that the approach is able to decouple the downwash induced wind speed caused by propellers and the ground effect, and accurately estimate the flight speed in a wind-free indoor environment. IMU, and barometer bias are effectively estimated, which significantly reduces the position integration drift, which is only 5.7m for 203s manual random flight. The open source is available on https://github.com/SyRoCo-ISIR/Flight-Speed-Estimation-Airflow.",2025-05-21 02:53:49+00:00,"Ze Wang, Jingang Qu, Zhenyu Gao, Pascal Morin",2505.15044v1,cs.RO
LogiCase: Effective Test Case Generation from Logical Description in Competitive Programming,"Automated Test Case Generation (ATCG) is crucial for evaluating software reliability, particularly in competitive programming where robust algorithm assessments depend on diverse and accurate test cases. However, existing ATCG methods often fail to meet complex specifications or generate effective corner cases, limiting their utility. In this work, we introduce Context-Free Grammars with Counters (CCFGs), a formalism that captures both syntactic and semantic structures in input specifications. Using a fine-tuned CodeT5 model, we translate natural language input specifications into CCFGs, enabling the systematic generation of high-quality test cases. Experiments on the CodeContests dataset demonstrate that CCFG-based test cases outperform baseline methods in identifying incorrect algorithms, achieving significant gains in validity and effectiveness. Our approach provides a scalable and reliable grammar-driven framework for enhancing automated competitive programming evaluations.",2025-05-21 02:48:01+00:00,"Sicheol Sung, Aditi, Dogyu kim, Yo-Sub Han, Sang-Ki Ko",2505.15039v1,cs.SE
Denoising Concept Vectors with Sparse Autoencoders for Improved Language Model Steering,"Linear Concept Vectors have proven effective for steering large language models (LLMs). While existing approaches like linear probing and difference-in-means derive these vectors from LLM hidden representations, diverse data introduces noises (i.e., irrelevant features) that challenge steering robustness. To address this, we propose Sparse Autoencoder-Denoised Concept Vectors (SDCV), which uses Sparse Autoencoders to filter out noisy features from hidden representations. When applied to linear probing and difference-in-means, our method improves their steering success rates. We validate our noise hypothesis through counterfactual experiments and feature visualizations.",2025-05-21 02:45:11+00:00,"Haiyan Zhao, Xuansheng Wu, Fan Yang, Bo Shen, Ninghao Liu, Mengnan Du",2505.15038v1,cs.CL
Fault-Tolerant Multi-Robot Coordination with Limited Sensing within Confined Environments,"As robots are increasingly deployed to collaborate on tasks within shared workspaces and resources, the failure of an individual robot can critically affect the group's performance. This issue is particularly challenging when robots lack global information or direct communication, relying instead on social interaction for coordination and to complete their tasks. In this study, we propose a novel fault-tolerance technique leveraging physical contact interactions in multi-robot systems, specifically under conditions of limited sensing and spatial confinement. We introduce the ""Active Contact Response"" (ACR) method, where each robot modulates its behavior based on the likelihood of encountering an inoperative (faulty) robot. Active robots are capable of collectively repositioning stationary and faulty peers to reduce obstructions and maintain optimal group functionality. We implement our algorithm in a team of autonomous robots, equipped with contact-sensing and collision-tolerance capabilities, tasked with collectively excavating cohesive model pellets. Experimental results indicate that the ACR method significantly improves the system's recovery time from robot failures, enabling continued collective excavation with minimal performance degradation. Thus, this work demonstrates the potential of leveraging local, social, and physical interactions to enhance fault tolerance and coordination in multi-robot systems operating in constrained and extreme environments.",2025-05-21 02:43:36+00:00,"Kehinde O. Aina, Hosain Bagheri, Daniel I. Goldman",2505.15036v1,cs.RO
RL Tango: Reinforcing Generator and Verifier Together for Language Reasoning,"Reinforcement learning (RL) has recently emerged as a compelling approach for enhancing the reasoning capabilities of large language models (LLMs), where an LLM generator serves as a policy guided by a verifier (reward model). However, current RL post-training methods for LLMs typically use verifiers that are fixed (rule-based or frozen pretrained) or trained discriminatively via supervised fine-tuning (SFT). Such designs are susceptible to reward hacking and generalize poorly beyond their training distributions. To overcome these limitations, we propose Tango, a novel framework that uses RL to concurrently train both an LLM generator and a verifier in an interleaved manner. A central innovation of Tango is its generative, process-level LLM verifier, which is trained via RL and co-evolves with the generator. Importantly, the verifier is trained solely based on outcome-level verification correctness rewards without requiring explicit process-level annotations. This generative RL-trained verifier exhibits improved robustness and superior generalization compared to deterministic or SFT-trained verifiers, fostering effective mutual reinforcement with the generator. Extensive experiments demonstrate that both components of Tango achieve state-of-the-art results among 7B/8B-scale models: the generator attains best-in-class performance across five competition-level math benchmarks and four challenging out-of-domain reasoning tasks, while the verifier leads on the ProcessBench dataset. Remarkably, both components exhibit particularly substantial improvements on the most difficult mathematical reasoning problems. Code is at: https://github.com/kaiwenzha/rl-tango.",2025-05-21 02:43:15+00:00,"Kaiwen Zha, Zhengqi Gao, Maohao Shen, Zhang-Wei Hong, Duane S. Boning, Dina Katabi",2505.15034v1,cs.LG
Toward Task Capable Active Matter: Learning to Avoid Clogging in Confined Collectives via Collisions,"Social organisms which construct nests consisting of tunnels and chambers necessarily navigate confined and crowded conditions. Unlike low-density collectives like bird flocks and insect swarms, in which hydrodynamic and statistical phenomena dominate, the physics of glasses and supercooled fluids is important to understand clogging behaviors in high-density collectives. Our previous work revealed that fire ants flowing in confined tunnels utilize diverse behaviors like unequal workload distributions, spontaneous direction reversals, and limited interaction times to mitigate clogging and jamming and thus maintain functional flow; implementation of similar rules in a small robophysical swarm led to high performance through spontaneous dissolution of clogs and clusters. However, how the insects learn such behaviors, and how we can develop ""task capable"" active matter in such regimes, remains a challenge in part because interaction dynamics are dominated by local, time-consuming collisions and no single agent can guide the entire collective. Here, we hypothesized that effective flow and clog mitigation could emerge purely through local learning. We tasked small groups of robots with pellet excavation in a narrow tunnel, allowing them to modify reversal probabilities over time. Initially, robots had equal probabilities and clogs were common. Reversals improved flow. When reversal probabilities adapted via collisions and noisy tunnel length estimates, workload inequality and performance improved. Our robophysical study of an excavating swarm shows that, despite the seeming complexity and difficulty of the task, simple learning rules can mitigate or leverage unavoidable features in task-capable dense active matter, leading to hypotheses for dense biological and robotic swarms.",2025-05-21 02:42:32+00:00,"Kehinde O. Aina, Ram Avinery, Hui-Shun Kuan, Meredith D. Betterton, Michael A. D. Goodisman, Daniel I. Goldman",2505.15033v1,cs.RO
Are the confidence scores of reviewers consistent with the review content? Evidence from top conference proceedings in AI,"Peer review is vital in academia for evaluating research quality. Top AI conferences use reviewer confidence scores to ensure review reliability, but existing studies lack fine-grained analysis of text-score consistency, potentially missing key details. This work assesses consistency at word, sentence, and aspect levels using deep learning and NLP conference review data. We employ deep learning to detect hedge sentences and aspects, then analyze report length, hedge word/sentence frequency, aspect mentions, and sentiment to evaluate text-score alignment. Correlation, significance, and regression tests examine confidence scores' impact on paper outcomes. Results show high text-score consistency across all levels, with regression revealing higher confidence scores correlate with paper rejection, validating expert assessments and peer review fairness.",2025-05-21 02:26:47+00:00,"Wenqing Wu, Haixu Xi, Chengzhi Zhang",2505.15031v1,cs.CL
Towards a Science of Causal Interpretability in Deep Learning for Software Engineering,"This dissertation addresses achieving causal interpretability in Deep Learning for Software Engineering (DL4SE). While Neural Code Models (NCMs) show strong performance in automating software tasks, their lack of transparency in causal relationships between inputs and outputs limits full understanding of their capabilities. To build trust in NCMs, researchers and practitioners must explain code predictions. Associational interpretability, which identifies correlations, is often insufficient for tasks requiring intervention and change analysis. To address this, the dissertation introduces DoCode, a novel post hoc interpretability method for NCMs. DoCode uses causal inference to provide programming language-oriented explanations of model predictions. It follows a four-step pipeline: modeling causal problems using Structural Causal Models (SCMs), identifying the causal estimand, estimating effects with metrics like Average Treatment Effect (ATE), and refuting effect estimates. Its framework is extensible, with an example that reduces spurious correlations by grounding explanations in programming language properties. A case study on deep code generation across interpretability scenarios and various deep learning architectures demonstrates DoCode's benefits. Results show NCMs' sensitivity to code syntax changes and their ability to learn certain programming concepts while minimizing confounding bias. The dissertation also examines associational interpretability as a foundation, analyzing software information's causal nature using tools like COMET and TraceXplainer for traceability. It highlights the need to identify code confounders and offers practical guidelines for applying causal interpretability to NCMs, contributing to more trustworthy AI in software engineering.",2025-05-21 02:13:11+00:00,David N. Palacio,2505.15023v1,cs.SE
HAVA: Hybrid Approach to Value-Alignment through Reward Weighing for Reinforcement Learning,"Our society is governed by a set of norms which together bring about the values we cherish such as safety, fairness or trustworthiness. The goal of value-alignment is to create agents that not only do their tasks but through their behaviours also promote these values. Many of the norms are written as laws or rules (legal / safety norms) but even more remain unwritten (social norms). Furthermore, the techniques used to represent these norms also differ. Safety / legal norms are often represented explicitly, for example, in some logical language while social norms are typically learned and remain hidden in the parameter space of a neural network. There is a lack of approaches in the literature that could combine these various norm representations into a single algorithm. We propose a novel method that integrates these norms into the reinforcement learning process. Our method monitors the agent's compliance with the given norms and summarizes it in a quantity we call the agent's reputation. This quantity is used to weigh the received rewards to motivate the agent to become value-aligned. We carry out a series of experiments including a continuous state space traffic problem to demonstrate the importance of the written and unwritten norms and show how our method can find the value-aligned policies. Furthermore, we carry out ablations to demonstrate why it is better to combine these two groups of norms rather than using either separately.",2025-05-21 01:32:54+00:00,"Kryspin Varys, Federico Cerutti, Adam Sobey, Timothy J. Norman",2505.15011v1,cs.AI
One-Layer Transformers are Provably Optimal for In-context Reasoning and Distributional Association Learning in Next-Token Prediction Tasks,"We study the approximation capabilities and on-convergence behaviors of one-layer transformers on the noiseless and noisy in-context reasoning of next-token prediction. Existing theoretical results focus on understanding the in-context reasoning behaviors for either the first gradient step or when the number of samples is infinite. Furthermore, no convergence rates nor generalization abilities were known. Our work addresses these gaps by showing that there exists a class of one-layer transformers that are provably Bayes-optimal with both linear and ReLU attention. When being trained with gradient descent, we show via a finite-sample analysis that the expected loss of these transformers converges at linear rate to the Bayes risk. Moreover, we prove that the trained models generalize to unseen samples as well as exhibit learning behaviors that were empirically observed in previous works. Our theoretical findings are further supported by extensive empirical validations.",2025-05-21 01:26:44+00:00,"Quan Nguyen, Thanh Nguyen-Tang",2505.15009v1,cs.LG
Know When to Abstain: Optimal Selective Classification with Likelihood Ratios,"Selective classification enhances the reliability of predictive models by allowing them to abstain from making uncertain predictions. In this work, we revisit the design of optimal selection functions through the lens of the Neyman--Pearson lemma, a classical result in statistics that characterizes the optimal rejection rule as a likelihood ratio test. We show that this perspective not only unifies the behavior of several post-hoc selection baselines, but also motivates new approaches to selective classification which we propose here. A central focus of our work is the setting of covariate shift, where the input distribution at test time differs from that at training. This realistic and challenging scenario remains relatively underexplored in the context of selective classification. We evaluate our proposed methods across a range of vision and language tasks, including both supervised learning and vision-language models. Our experiments demonstrate that our Neyman--Pearson-informed methods consistently outperform existing baselines, indicating that likelihood ratio-based selection offers a robust mechanism for improving selective classification under covariate shifts. Our code is publicly available at https://github.com/clear-nus/sc-likelihood-ratios.",2025-05-21 01:26:21+00:00,"Alvin Heng, Harold Soh",2505.15008v1,cs.LG
Unraveling the iterative CHAD,"Combinatory Homomorphic Automatic Differentiation (CHAD) was originally formulated as a semantics-driven source transformation for reverse-mode AD in total programming languages. We extend this framework to partial languages with features such as potentially non-terminating operations, real-valued conditionals, and iteration constructs like while-loops, while preserving CHAD's structure-preserving semantics principle. A key contribution is the introduction of iteration-extensive indexed categories, which allow iteration in the base category to lift to parameterized initial algebras in the indexed category. This enables iteration to be interpreted in the Grothendieck construction of the target language in a principled way. The resulting fibred iterative structure cleanly models iteration in the categorical semantics. Consequently, the extended CHAD transformation remains the unique structure-preserving functor (an iterative Freyd category morphism) from the freely generated iterative Freyd category of the source language to the Grothendieck construction of the target's syntactic semantics, mapping each primitive operation to its derivative. We prove the correctness of this transformation using the universal property of the source language's syntax, showing that the transformed programs compute correct reverse-mode derivatives. Our development also contributes to understanding iteration constructs within dependently typed languages and categories of containers. As our primary motivation and application, we generalize CHAD to languages with data types, partial features, and iteration, providing the first rigorous categorical semantics for reverse-mode CHAD in such settings and formally guaranteeing the correctness of the source-to-source CHAD technique.",2025-05-21 01:10:40+00:00,"Fernando Lucatelli Nunes, Gordon Plotkin, Matthijs Vákár",2505.15002v1,cs.PL
Learning to Rank Chain-of-Thought: An Energy-Based Approach with Outcome Supervision,"Mathematical reasoning presents a significant challenge for Large Language Models (LLMs), often requiring robust multi step logical consistency. While Chain of Thought (CoT) prompting elicits reasoning steps, it doesn't guarantee correctness, and improving reliability via extensive sampling is computationally costly. This paper introduces the Energy Outcome Reward Model (EORM), an effective, lightweight, post hoc verifier. EORM leverages Energy Based Models (EBMs) to simplify the training of reward models by learning to assign a scalar energy score to CoT solutions using only outcome labels, thereby avoiding detailed annotations. It achieves this by interpreting discriminator output logits as negative energies, effectively ranking candidates where lower energy is assigned to solutions leading to correct final outcomes implicitly favoring coherent reasoning. On mathematical benchmarks (GSM8k, MATH), EORM significantly improves final answer accuracy (e.g., with Llama 3 8B, achieving 90.7% on GSM8k and 63.7% on MATH). EORM effectively leverages a given pool of candidate solutions to match or exceed the performance of brute force sampling, thereby enhancing LLM reasoning outcome reliability through its streamlined post hoc verification process.",2025-05-21 01:06:29+00:00,"Eric Hanchen Jiang, Haozheng Luo, Shengyuan Pang, Xiaomin Li, Zhenting Qi, Hengli Li, Cheng-Fu Yang, Zongyu Lin, Xinfeng Li, Hao Xu, Kai-Wei Chang, Ying Nian Wu",2505.14999v1,cs.LG
Meta-Design Matters: A Self-Design Multi-Agent System,"Multi-agent systems (MAS) leveraging the impressive capabilities of Large Language Models (LLMs) hold significant potential for tackling complex tasks. However, most current MAS depend on manually designed agent roles and communication protocols. These manual designs often fail to align with the underlying LLMs' strengths and struggle to adapt to novel tasks. Recent automatic MAS approaches attempt to mitigate these limitations but typically necessitate a validation-set for tuning and yield static MAS designs lacking adaptability during inference. We introduce SELF-MAS, the first self-supervised, inference-time only framework for automatic MAS design. SELF-MAS employs meta-level design to iteratively generate, evaluate, and refine MAS configurations tailored to each problem instance, without requiring a validation set. Critically, it enables dynamic agent composition and problem decomposition through meta-feedback on solvability and completeness. Experiments across math, graduate-level QA, and software engineering benchmarks, using both closed-source and open-source LLM back-bones of varying sizes, demonstrate that SELF-MAS outperforms both manual and automatic MAS baselines, achieving a 7.44% average accuracy improvement over the next strongest baseline while maintaining cost-efficiency. These findings underscore the promise of meta-level self-supervised design for creating effective and adaptive MAS.",2025-05-21 00:56:09+00:00,"Zixuan Ke, Austin Xu, Yifei Ming, Xuan-Phi Nguyen, Caiming Xiong, Shafiq Joty",2505.14996v1,cs.CL
