title,abstract,date,authors,arxiv_id,primary_category
Shared Path: Unraveling Memorization in Multilingual LLMs through Language Similarities,"We present the first comprehensive study of Memorization in Multilingual Large Language Models (MLLMs), analyzing 95 languages using models across diverse model scales, architectures, and memorization definitions. As MLLMs are increasingly deployed, understanding their memorization behavior has become critical. Yet prior work has focused primarily on monolingual models, leaving multilingual memorization underexplored, despite the inherently long-tailed nature of training corpora. We find that the prevailing assumption, that memorization is highly correlated with training data availability, fails to fully explain memorization patterns in MLLMs. We hypothesize that treating languages in isolation - ignoring their similarities - obscures the true patterns of memorization. To address this, we propose a novel graph-based correlation metric that incorporates language similarity to analyze cross-lingual memorization. Our analysis reveals that among similar languages, those with fewer training tokens tend to exhibit higher memorization, a trend that only emerges when cross-lingual relationships are explicitly modeled. These findings underscore the importance of a language-aware perspective in evaluating and mitigating memorization vulnerabilities in MLLMs. This also constitutes empirical evidence that language similarity both explains Memorization in MLLMs and underpins Cross-lingual Transferability, with broad implications for multilingual NLP.",2025-05-21 16:30:18+00:00,"Xiaoyu Luo, Yiyi Chen, Johannes Bjerva, Qiongxiu Li",2505.15722v1,cs.CL
HAMF: A Hybrid Attention-Mamba Framework for Joint Scene Context Understanding and Future Motion Representation Learning,"Motion forecasting represents a critical challenge in autonomous driving systems, requiring accurate prediction of surrounding agents' future trajectories. While existing approaches predict future motion states with the extracted scene context feature from historical agent trajectories and road layouts, they suffer from the information degradation during the scene feature encoding. To address the limitation, we propose HAMF, a novel motion forecasting framework that learns future motion representations with the scene context encoding jointly, to coherently combine the scene understanding and future motion state prediction. We first embed the observed agent states and map information into 1D token sequences, together with the target multi-modal future motion features as a set of learnable tokens. Then we design a unified Attention-based encoder, which synergistically combines self-attention and cross-attention mechanisms to model the scene context information and aggregate future motion features jointly. Complementing the encoder, we implement the Mamba module in the decoding stage to further preserve the consistency and correlations among the learned future motion representations, to generate the accurate and diverse final trajectories. Extensive experiments on Argoverse 2 benchmark demonstrate that our hybrid Attention-Mamba model achieves state-of-the-art motion forecasting performance with the simple and lightweight architecture.",2025-05-21 16:16:52+00:00,"Xiaodong Mei, Sheng Wang, Jie Cheng, Yingbing Chen, Dan Xu",2505.15703v1,cs.CV
A Unified Theoretical Analysis of Private and Robust Offline Alignment: from RLHF to DPO,"In this paper, we theoretically investigate the effects of noisy labels in offline alignment, with a focus on the interplay between privacy and robustness against adversarial corruption. Specifically, under linear modeling assumptions, we present a unified analysis covering both reinforcement learning from human feedback (RLHF) and direct preference optimization (DPO) under different privacy-corruption scenarios, such as Local differential privacy-then-Corruption (LTC), where human preference labels are privatized before being corrupted by an adversary, and Corruption-then-Local differential privacy (CTL), where labels are corrupted before privacy protection. Our analysis leverages a reduction framework that reduces the offline alignment problem under linear modeling assumptions to parameter estimation in logistic regression. This framework allows us to establish an interesting separation result between LTC and CTL, demonstrating that LTC presents a greater challenge than CTL in offline alignment, even under linear models. As important by-products, our findings also advance the state-of-the-art theoretical results in offline alignment under privacy-only or corruption-only scenarios.",2025-05-21 16:07:47+00:00,"Xingyu Zhou, Yulian Wu, Francesco Orabona",2505.15694v1,cs.LG
Average Reward Reinforcement Learning for Omega-Regular and Mean-Payoff Objectives,"Recent advances in reinforcement learning (RL) have renewed focus on the design of reward functions that shape agent behavior. Manually designing reward functions is tedious and error-prone. A principled alternative is to specify behaviors in a formal language that can be automatically translated into rewards. Omega-regular languages are a natural choice for this purpose, given their established role in formal verification and synthesis. However, existing methods using omega-regular specifications typically rely on discounted reward RL in episodic settings, with periodic resets. This setup misaligns with the semantics of omega-regular specifications, which describe properties over infinite behavior traces. In such cases, the average reward criterion and the continuing setting -- where the agent interacts with the environment over a single, uninterrupted lifetime -- are more appropriate. To address the challenges of infinite-horizon, continuing tasks, we focus on absolute liveness specifications -- a subclass of omega-regular languages that cannot be violated by any finite behavior prefix, making them well-suited to the continuing setting. We present the first model-free RL framework that translates absolute liveness specifications to average-reward objectives. Our approach enables learning in communicating MDPs without episodic resetting. We also introduce a reward structure for lexicographic multi-objective optimization, aiming to maximize an external average-reward objective among the policies that also maximize the satisfaction probability of a given omega-regular specification. Our method guarantees convergence in unknown communicating MDPs and supports on-the-fly reductions that do not require full knowledge of the environment, thus enabling model-free RL. Empirical results show our average-reward approach in continuing setting outperforms discount-based methods across benchmarks.",2025-05-21 16:06:51+00:00,"Milad Kazemi, Mateo Perez, Fabio Somenzi, Sadegh Soudjani, Ashutosh Trivedi, Alvaro Velasquez",2505.15693v1,cs.AI
Discovering Pathology Rationale and Token Allocation for Efficient Multimodal Pathology Reasoning,"Multimodal pathological image understanding has garnered widespread interest due to its potential to improve diagnostic accuracy and enable personalized treatment through integrated visual and textual data. However, existing methods exhibit limited reasoning capabilities, which hamper their ability to handle complex diagnostic scenarios. Additionally, the enormous size of pathological images leads to severe computational burdens, further restricting their practical deployment. To address these limitations, we introduce a novel bilateral reinforcement learning framework comprising two synergistic branches. One reinforcement branch enhances the reasoning capability by enabling the model to learn task-specific decision processes, i.e., pathology rationales, directly from labels without explicit reasoning supervision. While the other branch dynamically allocates a tailored number of tokens to different images based on both their visual content and task context, thereby optimizing computational efficiency. We apply our method to various pathological tasks such as visual question answering, cancer subtyping, and lesion detection. Extensive experiments show an average +41.7 absolute performance improvement with 70.3% lower inference costs over the base models, achieving both reasoning accuracy and computational efficiency.",2025-05-21 16:03:03+00:00,"Zhe Xu, Cheng Jin, Yihui Wang, Ziyi Liu, Hao Chen",2505.15687v1,cs.CV
"A Federated Splitting Framework for LLMs: Security, Efficiency, and Adaptability","Private data is typically larger and of higher quality than public data, offering great potential to improve LLM. However, its scattered distribution across data silos and the high computational demands of LLMs limit their deployment in federated environments. To address this, the transformer-based split learning model has emerged, offloading most model parameters to the server while retaining only the embedding and output layers on clients to ensure privacy. However, it still faces significant challenges in security, efficiency, and adaptability: 1) embedding gradients are vulnerable to attacks, leading to reverse engineering of private data; 2) the autoregressive nature of LLMs means that federated split learning can only train and infer sequentially, causing high communication overhead; 3) fixed partition points lack adaptability to downstream tasks. In this paper, we introduce FL-LLaMA, a secure, efficient, and adaptive federated split framework based on LLaMA2. First, we place some input and output blocks on the local client and inject Gaussian noise into forward-pass hidden states, enabling secure end-to-end propagation. Second, we employ client-batch and server-hierarchical strategies to achieve parallel training, along with attention-mask compression and KV cache mechanisms to accelerate inference, reducing communication costs effectively. Third, we allow users to dynamically adjust the partition points for input/output blocks based on specific task requirements and hardware limitations. Experiments on NLU, summarization and conversational QA tasks show that FL-LLaMA maintains performance comparable to centralized LLaMA2, and achieves up to 2x train speedups and 8x inference speedups. Further analysis of privacy attacks and different partition points also demonstrates the effectiveness of FL-LLaMA in security and adaptability.",2025-05-21 15:58:08+00:00,"Zishuai Zhang, Hainan Zhang, Jiaying Zheng, Ziwei Wang, Yongxin Tong, Jin Dong, Zhiming Zheng",2505.15683v1,cs.CL
UniErase: Unlearning Token as a Universal Erasure Primitive for Language Models,"Large language models require iterative updates to address challenges such as knowledge conflicts and outdated information (e.g., incorrect, private, or illegal contents). Machine unlearning provides a systematic methodology for targeted knowledge removal from trained models, enabling elimination of sensitive information influences. However, mainstream fine-tuning-based unlearning methods often fail to balance unlearning efficacy and model ability, frequently resulting in catastrophic model collapse under extensive knowledge removal. Meanwhile, in-context unlearning, which relies solely on contextual prompting without modifying the model's intrinsic mechanisms, suffers from limited generalizability and struggles to achieve true unlearning. In this work, we introduce UniErase, a novel unlearning paradigm that employs learnable parametric suffix (unlearning token) to steer language models toward targeted forgetting behaviors. UniErase operates through two key phases: (I) an optimization stage that binds desired unlearning outputs to the model's autoregressive probability distribution via token optimization, followed by (II) a lightweight model editing phase that activates the learned token to probabilistically induce specified forgetting objective. Serving as a new research direction for token learning to induce unlearning target, UniErase achieves state-of-the-art (SOTA) performance across batch, sequential, and precise unlearning under fictitious and real-world knowledge settings. Remarkably, in terms of TOFU benchmark, UniErase, modifying only around 3.66% of the LLM parameters, outperforms previous forgetting SOTA baseline by around 4.01 times for model ability with even better unlearning efficacy. Similarly, UniErase, maintaining more ability, also surpasses previous retaining SOTA by 35.96% for unlearning efficacy, showing dual top-tier performances in current unlearing domain.",2025-05-21 15:53:28+00:00,"Miao Yu, Liang Lin, Guibin Zhang, Xinfeng Li, Junfeng Fang, Ningyu Zhang, Kun Wang, Yang Wang",2505.15674v1,cs.CL
Enhancing Monte Carlo Dropout Performance for Uncertainty Quantification,"Knowing the uncertainty associated with the output of a deep neural network is of paramount importance in making trustworthy decisions, particularly in high-stakes fields like medical diagnosis and autonomous systems. Monte Carlo Dropout (MCD) is a widely used method for uncertainty quantification, as it can be easily integrated into various deep architectures. However, conventional MCD often struggles with providing well-calibrated uncertainty estimates. To address this, we introduce innovative frameworks that enhances MCD by integrating different search solutions namely Grey Wolf Optimizer (GWO), Bayesian Optimization (BO), and Particle Swarm Optimization (PSO) as well as an uncertainty-aware loss function, thereby improving the reliability of uncertainty quantification. We conduct comprehensive experiments using different backbones, namely DenseNet121, ResNet50, and VGG16, on various datasets, including Cats vs. Dogs, Myocarditis, Wisconsin, and a synthetic dataset (Circles). Our proposed algorithm outperforms the MCD baseline by 2-3% on average in terms of both conventional accuracy and uncertainty accuracy while achieving significantly better calibration. These results highlight the potential of our approach to enhance the trustworthiness of deep learning models in safety-critical applications.",2025-05-21 15:50:03+00:00,"Hamzeh Asgharnezhad, Afshar Shamsi, Roohallah Alizadehsani, Arash Mohammadi, Hamid Alinejad-Rokny",2505.15671v1,cs.CV
Neural Quantum Digital Twins for Optimizing Quantum Annealing,"Quantum annealers have shown potential in addressing certain combinatorial optimization problems, though their performance is often limited by scalability and errors rates. In this work, we propose a Neural Quantum Digital Twin (NQDT) framework that reconstructs the energy landscape of quantum many-body systems relevant to quantum annealing. The digital twin models both ground and excited state dynamics, enabling detailed simulation of the adiabatic evolution process. We benchmark NQDT on systems with known analytical solutions and demonstrate that it accurately captures key quantum phenomena, including quantum criticality and phase transitions. Leveraging this framework, one can identify optimal annealing schedules that minimize excitation-related errors. These findings highlight the utility of neural network-based digital twins as a diagnostic and optimization tool for improving the performance of quantum annealers.",2025-05-21 15:38:55+00:00,"Jianlong Lu, Hanqiu Peng, Ying Chen",2505.15662v1,quant-ph
LCDB 1.1: A Database Illustrating Learning Curves Are More Ill-Behaved Than Previously Thought,"Sample-wise learning curves plot performance versus training set size. They are useful for studying scaling laws and speeding up hyperparameter tuning and model selection. Learning curves are often assumed to be well-behaved: monotone (i.e. improving with more data) and convex. By constructing the Learning Curves Database 1.1 (LCDB 1.1), a large-scale database with high-resolution learning curves, we show that learning curves are less often well-behaved than previously thought. Using statistically rigorous methods, we observe significant ill-behavior in approximately 14% of the learning curves, almost twice as much as in previous estimates. We also identify which learners are to blame and show that specific learners are more ill-behaved than others. Additionally, we demonstrate that different feature scalings rarely resolve ill-behavior. We evaluate the impact of ill-behavior on downstream tasks, such as learning curve fitting and model selection, and find it poses significant challenges, underscoring the relevance and potential of LCDB 1.1 as a challenging benchmark for future research.",2025-05-21 15:32:42+00:00,"Cheng Yan, Felix Mohr, Tom Viering",2505.15657v1,cs.LG
Second-Order Convergence in Private Stochastic Non-Convex Optimization,"We investigate the problem of finding second-order stationary points (SOSP) in differentially private (DP) stochastic non-convex optimization. Existing methods suffer from two key limitations: (i) inaccurate convergence error rate due to overlooking gradient variance in the saddle point escape analysis, and (ii) dependence on auxiliary private model selection procedures for identifying DP-SOSP, which can significantly impair utility, particularly in distributed settings. To address these issues, we propose a generic perturbed stochastic gradient descent (PSGD) framework built upon Gaussian noise injection and general gradient oracles. A core innovation of our framework is using model drift distance to determine whether PSGD escapes saddle points, ensuring convergence to approximate local minima without relying on second-order information or additional DP-SOSP identification. By leveraging the adaptive DP-SPIDER estimator as a specific gradient oracle, we develop a new DP algorithm that rectifies the convergence error rates reported in prior work. We further extend this algorithm to distributed learning with arbitrarily heterogeneous data, providing the first formal guarantees for finding DP-SOSP in such settings. Our analysis also highlights the detrimental impacts of private selection procedures in distributed learning under high-dimensional models, underscoring the practical benefits of our design. Numerical experiments on real-world datasets validate the efficacy of our approach.",2025-05-21 15:25:23+00:00,"Youming Tao, Zuyuan Zhang, Dongxiao Yu, Xiuzhen Cheng, Falko Dressler, Di Wang",2505.15647v1,cs.LG
FragFake: A Dataset for Fine-Grained Detection of Edited Images with Vision Language Models,"Fine-grained edited image detection of localized edits in images is crucial for assessing content authenticity, especially given that modern diffusion models and image editing methods can produce highly realistic manipulations. However, this domain faces three challenges: (1) Binary classifiers yield only a global real-or-fake label without providing localization; (2) Traditional computer vision methods often rely on costly pixel-level annotations; and (3) No large-scale, high-quality dataset exists for modern image-editing detection techniques. To address these gaps, we develop an automated data-generation pipeline to create FragFake, the first dedicated benchmark dataset for edited image detection, which includes high-quality images from diverse editing models and a wide variety of edited objects. Based on FragFake, we utilize Vision Language Models (VLMs) for the first time in the task of edited image classification and edited region localization. Experimental results show that fine-tuned VLMs achieve higher average Object Precision across all datasets, significantly outperforming pretrained models. We further conduct ablation and transferability analyses to evaluate the detectors across various configurations and editing scenarios. To the best of our knowledge, this work is the first to reformulate localized image edit detection as a vision-language understanding task, establishing a new paradigm for the field. We anticipate that this work will establish a solid foundation to facilitate and inspire subsequent research endeavors in the domain of multimodal content authenticity.",2025-05-21 15:22:45+00:00,"Zhen Sun, Ziyi Zhang, Zeren Luo, Zeyang Sha, Tianshuo Cong, Zheng Li, Shiwen Cui, Weiqiang Wang, Jiaheng Wei, Xinlei He, Qi Li, Qian Wang",2505.15644v1,cs.CV
Listen to the Context: Towards Faithful Large Language Models for Retrieval Augmented Generation on Climate Questions,"Large language models that use retrieval augmented generation have the potential to unlock valuable knowledge for researchers, policymakers, and the public by making long and technical climate-related documents more accessible. While this approach can help alleviate factual hallucinations by relying on retrieved passages as additional context, its effectiveness depends on whether the model's output remains faithful to these passages. To address this, we explore the automatic assessment of faithfulness of different models in this setting. We then focus on ClimateGPT, a large language model specialised in climate science, to examine which factors in its instruction fine-tuning impact the model's faithfulness. By excluding unfaithful subsets of the model's training data, we develop ClimateGPT Faithful+, which achieves an improvement in faithfulness from 30% to 57% in supported atomic claims according to our automatic metric.",2025-05-21 15:17:38+00:00,"David Thulke, Jakob Kemmler, Christian Dugast, Hermann Ney",2505.15633v1,cs.CL
Learn to Reason Efficiently with Adaptive Length-based Reward Shaping,"Large Reasoning Models (LRMs) have shown remarkable capabilities in solving complex problems through reinforcement learning (RL), particularly by generating long reasoning traces. However, these extended outputs often exhibit substantial redundancy, which limits the efficiency of LRMs. In this paper, we investigate RL-based approaches to promote reasoning efficiency. Specifically, we first present a unified framework that formulates various efficient reasoning methods through the lens of length-based reward shaping. Building on this perspective, we propose a novel Length-bAsed StEp Reward shaping method (LASER), which employs a step function as the reward, controlled by a target length. LASER surpasses previous methods, achieving a superior Pareto-optimal balance between performance and efficiency. Next, we further extend LASER based on two key intuitions: (1) The reasoning behavior of the model evolves during training, necessitating reward specifications that are also adaptive and dynamic; (2) Rather than uniformly encouraging shorter or longer chains of thought (CoT), we posit that length-based reward shaping should be difficulty-aware i.e., it should penalize lengthy CoTs more for easy queries. This approach is expected to facilitate a combination of fast and slow thinking, leading to a better overall tradeoff. The resulting method is termed LASER-D (Dynamic and Difficulty-aware). Experiments on DeepSeek-R1-Distill-Qwen-1.5B, DeepSeek-R1-Distill-Qwen-7B, and DeepSeek-R1-Distill-Qwen-32B show that our approach significantly enhances both reasoning performance and response length efficiency. For instance, LASER-D and its variant achieve a +6.1 improvement on AIME2024 while reducing token usage by 63%. Further analysis reveals our RL-based compression produces more concise reasoning patterns with less redundant ""self-reflections"". Resources are at https://github.com/hkust-nlp/Laser.",2025-05-21 15:03:26+00:00,"Wei Liu, Ruochen Zhou, Yiyun Deng, Yuzhen Huang, Junteng Liu, Yuntian Deng, Yizhe Zhang, Junxian He",2505.15612v1,cs.CL
From Problem-Solving to Teaching Problem-Solving: Aligning LLMs with Pedagogy using Reinforcement Learning,"Large language models (LLMs) can transform education, but their optimization for direct question-answering often undermines effective pedagogy which requires strategically withholding answers. To mitigate this, we propose an online reinforcement learning (RL)-based alignment framework that can quickly adapt LLMs into effective tutors using simulated student-tutor interactions by emphasizing pedagogical quality and guided problem-solving over simply giving away answers. We use our method to train a 7B parameter tutor model without human annotations which reaches similar performance to larger proprietary models like LearnLM. We introduce a controllable reward weighting to balance pedagogical support and student solving accuracy, allowing us to trace the Pareto frontier between these two objectives. Our models better preserve reasoning capabilities than single-turn SFT baselines and can optionally enhance interpretability through thinking tags that expose the model's instructional planning.",2025-05-21 15:00:07+00:00,"David Dinucu-Jianu, Jakub Macina, Nico Daheim, Ido Hakimi, Iryna Gurevych, Mrinmaya Sachan",2505.15607v1,cs.CL
